{
  "schema_version": "reference-candidate-v1",
  "view_label": "M02",
  "status": "reference_candidate",
  "basis": "stored_postprocessing",
  "text": "Итак, давай пройдемся с тобой по окнам. Ты отчитался об успешном деплое, что все работает, но я здесь сразу же вижу кучу проблем.\n\nENTITY_002 начнем с первого окна — «ENTITY_008». Я не вижу здесь прогнозируемой цены. Я понимаю, что цену трудно спрогнозировать при подаче ассетов в изображении, хотя технически это, думаю, вполне возможно. Но я хотел бы видеть хотя бы предварительную, примерную цену, исходя из нашего файла, где полностью прописана сетка цен для всех качеств, размеров, моделей и поставщиков. Это во-первых. Во-вторых, я нажимаю кнопку «ENTITY_007», но она не работает. Я фактически получаю какие-то заглушки: «ENTITY_004 ассет №1», «№2» и так далее. То есть я не могу добавить изображения из базы данных, которые я уже сгенерировал. Это достаточно плохо.\n\nВо-вторых, если посмотреть на сам макет приложения, то я вижу во вкладке «ENTITY_008» разделение на две половины, при этом задействована только левая, а правая пустая. Возможно, там предполагался перечень ассетов или это просто косяк в верстке. ENTITY_003 — я хотел бы иметь возможность импортировать ассеты и видеть в карточках какую-то информацию о них. Это было бы полезно.\n\nENTITY_005 говорить про вкладку «ENTITY_010», то проблема следующего характера: я не могу перезапустить очередь. Допустим, я забыл добавить API-ключ поставщика, очередь упала с ошибкой. Я добавил ключ, но ни одна кнопка не работает — ни «ENTITY_009 все», ни «ENTITY_006 все». При этом, когда очередь отработала, эти кнопки тоже остаются нерабочими. У меня есть одна очередь, которая закончилась успехом, другая — провалом, но кнопки ничего не делают. Это баг.\n\nИдем дальше. Галерея. Вопросов здесь, в принципе, нет, карточки прикольные. Единственное, хотелось бы иметь возможность открыть картинку на весь экран или сделать детали результата крупнее. \n\nЕще я заметил, что ты молодец — убрал меню на английском языке сверху, но вместе с этим убрал возможность масштабировать приложение через `ENTITY_001+` / `ENTITY_001-`. Сейчас некоторые элементы кажутся мелкими и не совсем читаемыми. В общем, интерфейс выглядит минималистично, я бы сказал — чересчур. Это даже еще не MVP, потому что главный функционал генерации картинок с ассетами сейчас, по сути, не работает. \n\nА еще я бы хотел, чтобы ты убедился, что в галерее я смогу видеть карточки и простым способом узнавать, на каких ассетах было сделано изображение. Допустим, в деталях результата или маленькими квадратиками прямо внизу карточки. \n\nВ общем, я хочу, чтобы ты запустил серию подо-агентов, точечно собрал всю информацию и выписал документ-план в документацию. Там нужно полностью описать все этапы работ, включая тесты, генерацию скриншотов и самопроверку. Также опиши, какие работы можно делать параллельно: чтобы можно было запускать несколько агентов одновременно, чтобы они работали над разными частями приложения.",
  "review_required": true
}
