{
  "schema_version": "reference-candidate-v1",
  "view_label": "M08",
  "status": "reference_candidate",
  "basis": "stored_postprocessing",
  "text": "@ENTITY_010 ENTITY_008 день! Как я говорю своим студентам: нет глупых вопросов, есть незаданные. ;)\n\nENTITY_006 так, программа действительно устанавливается на компьютер через стандартный установщик, как и многие другие приложения. Поддерживается исключительно [B]ENTITY_004 11[PATH_002 На «десятке» стабильная работа не гарантируется, а серверные версии ENTITY_004 мы не поддерживаем.\n\nПо большому счету, программа имеет два основных функционала. Первый — это [B]диктовка под курсор[PATH_001 (наподобие той, которой я пишу этот ответ), где есть множество настроек для качественной и интересной работы.\n\nВторой функционал — это возможность достать текст из любых видео, аудио и даже изображений (получить описание картинок) с вашего локального компьютера. Это важно: из интернета видео вы скачиваете сами, хотя сейчас за отзыв я предоставляю инструмент для массовой выгрузки роликов с [I]ENTITY_005[PATH_003\n\nПосле того как программа обработает ваши материалы, есть два пути:\n[LIST]\n[*]ENTITY_009 у вас [B]мощный компьютер[PATH_001 с хорошей видеокартой, работа может быть полностью локальной, без отправки данных в интернет и совершенно бесплатно.\n[*]ENTITY_009 мощного ПК нет, то самая ресурсоемкая операция (извлечение аудио и превращение его в текст) все равно будет идти на вашем компьютере, а вот постобработка (расстановка знаков препинания, удаление слов-паразитов, перевод, создание синхронных тайм-кодов) пойдет через [B]облачные нейросети[PATH_002\n[PATH_004\nENTITY_007 облачной обработки потребуются небольшие затраты, но мы поддерживаем российского посредника, где можно платить в рублях без «конской» наценки.\n\nВнутри программы есть удобный плеер, где можно смотреть видео сразу с обработанными субтитрами — это очень выручает при переводе с иностранных языков.\n\nВ целом, программа представляет собой сервер [I]ENTITY_002 ENTITY_001 ENTITY_003[PATH_003 Вы можете подключить локального агента, который будет пользоваться всеми этими инструментами, извлекать нужные данные из ваших файлов и анализировать их. Также вы сможете пользоваться встроенным поиском и работать со всей информацией вручную.",
  "review_required": true
}
