{
  "schema_version": "reference-candidate-v1",
  "view_label": "M03",
  "status": "reference_candidate",
  "basis": "stored_postprocessing",
  "text": "ENTITY_004 день! К сожалению, я не властен над шалостями ENTITY_005 и проблемами соединения в ENTITY_006, но я добавил в версию 0.995 возможность установить proxy, через которые будут идти все загрузки, а также обращение к ENTITY_001.\n\nА также я добавил в гайды инструкцию о том, как вручную установить модель ENTITY_003 в приложении. ENTITY_007 гайд появился в папке с руководствами, а также я добавил в библиотеку сами модели. Я думаю, что скачать их из облака не должно быть проблемой.\n\nОчень жаль, что вы столкнулись с таким большим количеством трудностей. Я постараюсь вам помочь, если будут вопросы, чтобы вы смогли установить эту модель и попробовать её работу в приложении.\n\nСам ресурс HuggingFace не объявлял санкции к ENTITY_006, так что это исключительно внутренние региональные проблемы, к моему сожалению.",
  "review_required": true
}
