{
  "schema_version": "reference-candidate-v1",
  "view_label": "M01",
  "status": "reference_candidate",
  "basis": "stored_postprocessing",
  "text": "Следующая твоя задача — сделать домашнее задание для группы ENTITY_001 ACCOUNT_002 на основе домашнего задания ENTITY_001 ACCOUNT_001 под номером 11.\n\nТы возьмёшь это домашнее задание, а также будешь использовать шаблон для создания домашних заданий и правила домашних заданий. Просто возьми это задание и сделай для ребят из группы ACCOUNT_002 домашнее задание под номером 11 от DATE_001.",
  "review_required": true
}
